,rating_ratingValue,rating_worstRating,rating_bestRating,rating_alternateName,creativeWork_author_name,creativeWork_datePublished,creativeWork_author_sameAs,claimReview_author_name,claimReview_author_url,claimReview_url,claimReview_claimReviewed,claimReview_datePublished,claimReview_source,claimReview_author,extra_body,extra_refered_links,extra_title,extra_tags,extra_entities_claimReview_claimReviewed,extra_entities_body,extra_entities_keywords,extra_entities_author,related_links
128,,,,Misleading,"""ప్రశాంత్ గుప్త""",,,Vishvanews,,https://www.vishvasnews.com/telugu/world/fact-check-australian-pm-anthony-albanese-was-not-wearing-saffron-scarf-while-taking-oath-of-office-misleading-claim-viral/,"""ఆస్ట్రేలియా కొత్త ప్రధానమంత్రి ఆంథోని ఆల్బనీస్ కాషాయ రంగు కండువా ధరించి ప్రమాణస్వీకారం చేశారు. జై శ్రీరాం……""",2022-5-28,Vishvanews,,"""విశ్వాస్ న్యూస్ జరిపిన దర్యాప్తులో ఈ వైరల్ క్లెయిమ్ నకిలీది అని తేలింది. ఈ వైరల్ చిత్రము హిందువులు నిర్వహించిన ఒక వేడుకలో ఆస్ట్రేలియా ప్రధాని ఆంథోని ఆల్బనీస్ ఉన్నది. ఇది ఇప్పుడు తప్పుదోవపట్టించే క్లెయిమ్స్ తో షేర్ చేయబడుతోంది""","""['https://perma.cc/PV7A-LWLY', 'https://www.theguardian.com/australia-news/live/2022/may/14/election-2022-live-updates-labor-promises-970m-for-medicare-morrison-prepares-for-coalition-campaign-launch-scott-morrison-anthony-albanese-flood-china-dutton-federal-election?CMP=share_btn_tw&page=with%3Ablock-627f69768f08493b6168ca33', 'https://www.theguardian.com/australia-news/live/2022/may/14/election-2022-live-updates-labor-promises-970m-for-medicare-morrison-prepares-for-coalition-campaign-launch-scott-morrison-anthony-albanese-flood-china-dutton-federal-election?CMP=share_btn_tw&page=with%3Ablock-627f69768f08493b6168ca33', 'https://www.abc.net.au/news/2022-05-19/scott-morrison-anthony-albanese-wear-scarves-with-vhp-logo/101072692', 'https://t.co/8QyVhv93pt', 'https://twitter.com/hashtag/Hinduism?src=hash&ref_src=twsrc%5Etfw', 'https://twitter.com/hashtag/Hindus?src=hash&ref_src=twsrc%5Etfw', 'https://twitter.com/hashtag/Australia?src=hash&ref_src=twsrc%5Etfw', 'https://twitter.com/hashtag/HinduCouncilAu?src=hash&ref_src=twsrc%5Etfw', 'https://twitter.com/hashtag/ALP?src=hash&ref_src=twsrc%5Etfw', 'https://twitter.com/hashtag/Elections2022?src=hash&ref_src=twsrc%5Etfw', 'https://twitter.com/hashtag/AnthonyAlbanese?src=hash&ref_src=twsrc%5Etfw', 'https://t.co/TXfBBVdzGo', 'https://twitter.com/AlboMP/status/1522528352816726016', 'https://t.co/6m79gzXhDz', 'https://www.youtube.com/watch?v=BF5P_di7Y7M', 'https://www.youtube.com/embed/BF5P_di7Y7M?feature=oembed']""","""వాస్తవ తనిఖీ: ప్రమాణ స్వీకారం సమయములో ఆస్ట్రేలియా ప్రధాని ఆంథోని ఆల్బనీస్ కాషాయ రంగు కండువా ధరించలేదు, వైరల్ అయిన క్లెయిమ్ తప్పుదోవపట్టించేది""","""['Fact Check']""",,,,,
129,,,,False,"""ఎంజిలో బేన్స్ జూ""",,,Vishvanews,,https://www.vishvasnews.com/telugu/viral/fact-check-elon-musk-did-not-tweet-viral-screenshot-is-fake/,"""ఫ్రెండ్‎స్టర్ కు ఫేస్ బుక్ చేసిన మాదిరిగానే ఇలాన్ మస్క్ ఫేస్ బుక్ ను కొనబోతున్నారు మరియు ఆయన దానిని తొలగించబోతున్నారు. దేవుడా! కర్మ అనేది నిజమే!!""",2022-5-9,Vishvanews,,"""విశ్వాస్ న్యూస్ వారు చేసిన దర్యాప్తులో ఈ వైరల్ క్లెయిమ్ అసత్యము అని తేలింది. ఇలాన్ మస్క్ ఇటువంటి ట్వీట్ ఏదీ చేయలేదు.""","""['https://www.facebook.com/photo/?fbid=5440937299271448&set=a.374652239233338', 'https://twitter.com/elonmusk', 'https://web.archive.org/web/20220425152527/https://twitter.com/elonmusk', 'https://webcache.googleusercontent.com/search?q=cache:XXRv53PLtLMJ:https://twitter.com/elonmusk/with_replies%3Flang%3Den+&cd=27&hl=en&ct=clnk&gl=in', 'https://twitter.com/elonmusk/status/977209817012977665', 'https://t.co/qNNfNHehJ2', 'https://twitter.com/hashtag/Tesla?src=hash&ref_src=twsrc%5Etfw', 'https://twitter.com/hashtag/SpaceX?src=hash&ref_src=twsrc%5Etfw', 'https://twitter.com/hashtag/ElonMusk?src=hash&ref_src=twsrc%5Etfw', 'https://twitter.com/hashtag/Facebook?src=hash&ref_src=twsrc%5Etfw']""","""వాస్తవ తనిఖీ: ఇలాన్ మస్క్ దీనిని ట్వీట్ చేయలేదు, వైరల్ అయిన స్క్రీన్‎షాట్ నకిలీది""","""['Elon Musk', 'Elon Musk Tweet']""",,,,,
130,,,,False,"""ముర్తాజా నక్వి""",,,Vishvanews,,https://www.vishvasnews.com/telugu/politics/fact-check-old-video-from-iraq-going-viral-with-fake-russia-ukraine-war-claim/,"""రష్యా సేనలు మరియు ఉక్రెయిన్ సైన్యము తాజాగా యుద్ధం చేస్తున్నాయి…""",2022-3-31,Vishvanews,,"""విశ్వాస్ న్యూస్ యొక్క దర్యాప్తులో, ఈ క్లెయిమ్ అసత్యము అని కనుగొనబడింది. వైరల్ అయిన వీడియో రష్యా-ఉక్రెయిన్ యుద్ధానికి సంబంధించినది కాదు. ఈ వీడియో 2004 ఇరాక్ కు సంబంధించినది.""","""['https://www.latimes.com/archives/la-xpm-2004-oct-06-fg-model6-story.html', 'https://www.youtube.com/embed/KL4ANIYCoqo?feature=oembed', 'https://www.youtube.com/embed/cEJLgMNPIz8?feature=oembed']""","""వాస్తవ తనిఖీ: ఇరాక్ నుండి ఒక పాత వీడియో రష్యా ఉక్రెయిన్ యుద్ధం గురించిన నకిలీ క్లెయిమ్ తో వైరల్ అవుతోంది""","""['Fact Check', 'Russia Ukraine Crisis', 'russia ukraine war']""",,,,,
131,,,,False,"""యోగేష్ దంగాయచ్ నమో""",,,Vishvanews,,https://www.vishvasnews.com/telugu/politics/fact-check-man-singing-with-women-on-stage-in-the-viral-video-isnt-ukrainian-president-volodymyr-zelensky/,"""యుక్రెయిన్ అధ్యక్షుడు వొలొడిమిర్ జెలెన్̦స్కీ""",2022-3-20,Vishvanews,,"""ఈ క్లెయిమ్ అవాస్తవం అని తన దర్యాప్తులో విశ్వాస్ న్యూస్ కనుగొనింది. వీడియోలో కనిపించే వ్యక్తి యుక్రెయిన్ అధ్యక్షుడు వొలొడిమిర్ జెలెన్‎స్కీ కాదు, ఆయన యుక్రెయిన్ బ్యాండ్ విన్నిషియా పెప్పర్స్ లోని ఒక కమెడియన్ మరియు ఉక్రేనియన్ రాజకీయవేత్త అయిన వసిలీ ల్యుబానియుకి.""","""['https://www.facebook.com/kvartal95/videos/1653975067959339', 'https://prolviv.com/blog/2017/10/24/vinnytski-humorysty-zirvaly-ovatsii-vykonanniam-pisni-ochi-divochi-video/', 'https://vinnytski.info/ru/article-1552-vinnickie-percy-rasskazali-sekret-svoego-uspekha', 'https://ria.ru/20200223/1565121363.html']""","""వాస్తవ తనిఖీ: వేదికపై మహిళతో పాడుతూ వైరల్ వీడియోలో కనిపిస్తున్న వ్యక్తి ఉక్రెయిన్ అధ్యక్షుడు వొలొడిమిర్ జెలెన్‎స్కీ కాదు""","""['Fact Check', 'Russia Ukraine Crisis', 'Ukraine']""",,,,,
132,,,,Misleading,"""Raja Chandra""",,,Vishvanews,,https://www.vishvasnews.com/telugu/viral/fact-check-nandi-idol-from-wai-maharashtra-being-shared-as-that-of-varanasi-2/,"""Nandi from Varanasi""",2022-6-17,Vishvanews,,"""వారణాసిలో జ్ఞానవాపి మసీదు ముందు ఉన్న నంది విగ్రహము అని షేర్ చేయబడిన వైరల్ చిత్రము వాయ్, సతారా లోని కాశీ విశ్వేశ్వర దేవాలయములోనిది. వైరల్ క్లెయిమ్స్ తప్పుదోవపట్టించేవి.""","""['https://perma.cc/T58Z-FGYM', 'https://www.alamy.com/stock-photo-nandi-bull-statue-in-kashi-vishweshwar-temple-at-wai-satara-maharashtra-83633471.html', 'https://dynamic-media-cdn.tripadvisor.com/media/photo-o/1c/85/11/d3/shri-kashi-vishweshwar.jpg?w=600&h=-1&s=1', 'https://www.alamy.com/stock-photo-nandi-statue-lord-shiva-temple-wai-satara-maharashtra-india-132854959.html']""","""వాస్తవ తనిఖీ: వాయ్, మహారాష్ట్రలోని నంది విగ్రహము వారణాసికి చెందినది అని షేర్ చేయబడింది""","""['Fact Check']""",,,,,
133,,,,Misleading,"""ప్రశాంత్ గుప్త""",,,Vishvanews,,https://www.vishvasnews.com/telugu/world/fact-check-australian-pm-anthony-albanese-was-not-wearing-saffron-scarf-while-taking-oath-of-office-misleading-claim-viral/,"""ఆస్ట్రేలియా కొత్త ప్రధానమంత్రి ఆంథోని ఆల్బనీస్ కాషాయ రంగు కండువా ధరించి ప్రమాణస్వీకారం చేశారు. జై శ్రీరాం……""",2022-5-28,Vishvanews,,"""విశ్వాస్ న్యూస్ జరిపిన దర్యాప్తులో ఈ వైరల్ క్లెయిమ్ నకిలీది అని తేలింది. ఈ వైరల్ చిత్రము హిందువులు నిర్వహించిన ఒక వేడుకలో ఆస్ట్రేలియా ప్రధాని ఆంథోని ఆల్బనీస్ ఉన్నది. ఇది ఇప్పుడు తప్పుదోవపట్టించే క్లెయిమ్స్ తో షేర్ చేయబడుతోంది""","""['https://perma.cc/PV7A-LWLY', 'https://www.theguardian.com/australia-news/live/2022/may/14/election-2022-live-updates-labor-promises-970m-for-medicare-morrison-prepares-for-coalition-campaign-launch-scott-morrison-anthony-albanese-flood-china-dutton-federal-election?CMP=share_btn_tw&page=with%3Ablock-627f69768f08493b6168ca33', 'https://www.theguardian.com/australia-news/live/2022/may/14/election-2022-live-updates-labor-promises-970m-for-medicare-morrison-prepares-for-coalition-campaign-launch-scott-morrison-anthony-albanese-flood-china-dutton-federal-election?CMP=share_btn_tw&page=with%3Ablock-627f69768f08493b6168ca33', 'https://www.abc.net.au/news/2022-05-19/scott-morrison-anthony-albanese-wear-scarves-with-vhp-logo/101072692', 'https://t.co/8QyVhv93pt', 'https://twitter.com/hashtag/Hinduism?src=hash&ref_src=twsrc%5Etfw', 'https://twitter.com/hashtag/Hindus?src=hash&ref_src=twsrc%5Etfw', 'https://twitter.com/hashtag/Australia?src=hash&ref_src=twsrc%5Etfw', 'https://twitter.com/hashtag/HinduCouncilAu?src=hash&ref_src=twsrc%5Etfw', 'https://twitter.com/hashtag/ALP?src=hash&ref_src=twsrc%5Etfw', 'https://twitter.com/hashtag/Elections2022?src=hash&ref_src=twsrc%5Etfw', 'https://twitter.com/hashtag/AnthonyAlbanese?src=hash&ref_src=twsrc%5Etfw', 'https://t.co/TXfBBVdzGo', 'https://twitter.com/AlboMP/status/1522528352816726016', 'https://t.co/6m79gzXhDz', 'https://www.youtube.com/watch?v=BF5P_di7Y7M', 'https://www.youtube.com/embed/BF5P_di7Y7M?feature=oembed']""","""వాస్తవ తనిఖీ: ప్రమాణ స్వీకారం సమయములో ఆస్ట్రేలియా ప్రధాని ఆంథోని ఆల్బనీస్ కాషాయ రంగు కండువా ధరించలేదు, వైరల్ అయిన క్లెయిమ్ తప్పుదోవపట్టించేది""","""['Fact Check']""",,,,,
134,,,,False,"""బాలు అన్న యువసేన""",,,Vishvanews,,https://www.vishvasnews.com/telugu/viral/fact-check-old-picture-of-uttarakhand-floods-falsely-linked-to-rains-in-bengaluru/,"""డబల్ ఇంజన్ ప్రభుత్వము బెంగళూరులో కారు ఈతల పోటీలు నిర్వహించింది. గమనిక: ఏ ప్రభుత్వము ప్రకృతి వైపరీత్యాలను ఆపలేదు.. వాటి తరువాత మీరు తీసుకునే చర్యలే ముఖ్యం.. హైదరాబాదులో వర్షాలు కురిసినప్పుడు కుక్క సంతోషాన్ని పొందే వారి కొరకు.""",2022-5-25,Vishvanews,,"""విశ్వాస్ న్యూస్ వారు జరిపిన దర్యాప్తులో ఈ వైరల్ క్లెయిమ్ తప్పుదోవపట్టించేది అని తేలింది. ఈ వైరల్ చిత్రానికి బెంగళూరులో ఇటీవల కురిసిన వర్షాలకు ఎలాంటి సంబంధం లేదు. ఈ చిత్రము 2021లో ఉత్తరాఖండ్ వరదలకు సంబంధించినది.""","""['https://www.facebook.com/permalink.php?story_fbid=139687831976561&id=100078060350914', 'https://www.financialexpress.com/photos/business-gallery/2353211/incessant-rains-batter-uttarakhand-connectivity-to-nainital-restored-see-photos/', 'https://english.alarabiya.net/News/world/2021/10/21/India-Nepal-flood-death-toll-mounts-to-150', 'https://www.jagran.com/uttarakhand/nainital-after-13-hours-150-tourists-were-rescued-by-tractor-trolley-leaving-submerged-cars-and-goods-lying-22129779.html']""","""వాస్తవ తనిఖీ: ఉత్తరాఖండ్ వరదలకు సంబంధించిన ఒక పాత చిత్రం బెంగళూరులోని భారీ వర్షాలకు తప్పుగా లింక్ చేయబడింది.""","""['Bengaluru Rains', 'Fact Check']""",,,,,
135,,,,False,"""ఎంజిలో బేన్స్ జూ""",,,Vishvanews,,https://www.vishvasnews.com/telugu/viral/fact-check-elon-musk-did-not-tweet-viral-screenshot-is-fake/,"""ఫ్రెండ్‎స్టర్ కు ఫేస్ బుక్ చేసిన మాదిరిగానే ఇలాన్ మస్క్ ఫేస్ బుక్ ను కొనబోతున్నారు మరియు ఆయన దానిని తొలగించబోతున్నారు. దేవుడా! కర్మ అనేది నిజమే!!""",2022-5-9,Vishvanews,,"""విశ్వాస్ న్యూస్ వారు చేసిన దర్యాప్తులో ఈ వైరల్ క్లెయిమ్ అసత్యము అని తేలింది. ఇలాన్ మస్క్ ఇటువంటి ట్వీట్ ఏదీ చేయలేదు.""","""['https://www.facebook.com/photo/?fbid=5440937299271448&set=a.374652239233338', 'https://twitter.com/elonmusk', 'https://web.archive.org/web/20220425152527/https://twitter.com/elonmusk', 'https://webcache.googleusercontent.com/search?q=cache:XXRv53PLtLMJ:https://twitter.com/elonmusk/with_replies%3Flang%3Den+&cd=27&hl=en&ct=clnk&gl=in', 'https://twitter.com/elonmusk/status/977209817012977665', 'https://t.co/qNNfNHehJ2', 'https://twitter.com/hashtag/Tesla?src=hash&ref_src=twsrc%5Etfw', 'https://twitter.com/hashtag/SpaceX?src=hash&ref_src=twsrc%5Etfw', 'https://twitter.com/hashtag/ElonMusk?src=hash&ref_src=twsrc%5Etfw', 'https://twitter.com/hashtag/Facebook?src=hash&ref_src=twsrc%5Etfw']""","""వాస్తవ తనిఖీ: ఇలాన్ మస్క్ దీనిని ట్వీట్ చేయలేదు, వైరల్ అయిన స్క్రీన్‎షాట్ నకిలీది""","""['Elon Musk', 'Elon Musk Tweet']""",,,,,
136,,,,False,"""పేజ్: కీ డీటాక్స్ లైఫ్""",,,Vishvanews,,https://www.vishvasnews.com/telugu/health/fact-check-colour-from-photo-of-shoe-doesnt-reveal-your-right-or-left-brain-dominant/,"""కుడి మరియు ఎడమ మెదడు ప్రాబల్యం, మీరు కుడి మెదడు ప్రాబల్యం కలిగి ఉంటే, మీరు గులాబి మరియు తెలుపు రంగుల సమ్మేళనాన్ని చూస్తారు, మరియు మీరు ఎడమ మెదడు ప్రాబల్యం కలిగి ఉంటే, మీరు బూడిదరంగు మరియు ఆకుపచ్చ రంగులో చూస్తారు. మీ ప్రియమైన వారితో కలిసి ప్రయత్నించండి, చాలా ఆసక్తికరమైనది""",2022-5-18,Vishvanews,,"""మీరు స్నీకర్ లో చూసే రంగుల ఆధారంగా మీరు కుడి లేదా ఎడమ-మెదడు ప్రాబల్యం కలిగిన వారు అని చెప్పే పోస్ట్ నకిలీది.""","""['https://perma.cc/TPJ4-WD23', 'https://people.com/style/vans-sneakers-color-debate-pink-and-white-teal-and-grey/', 'https://www.health.com/mind-body/sneaker-optical-illusion', 'https://www.health.com/mind-body/sneaker-optical-illusion', 'https://jov.arvojournals.org/article.aspx?articleid=2600950#151450532', 'http://as%20per%20an%20article%20in%20discover%20magazine%2C%20according%20to%20a%20science%20writer%2C%20%22no%20matter%20how%20lateralized%20the%20brain%20can%20get%2C%20the%20two%20sides%20still%20work%20together.%22%20https//www.discovermagazine.com/the-sciences/doublethink']""","""వాస్తవ తనిఖీ: బూటు యొక్క ఫోటోలోని రంగు మీరు కుడి లేదా ఎడమ మెదడు ప్రాబల్యం కలిగిన వారు అని వెల్లడించదు""","""['Fact Check']""",,,,,
137,,,,Misleading,"""న్యూట్రీషనిస్ట్ అలీజాయ్ ఖాట్టక్""",,,Vishvanews,,https://www.vishvasnews.com/telugu/health/fact-check-post-claiming-almonds-work-better-than-aspirin-for-headaches-is-misleading-claim/,"""ఒక సోషల్ మీడియా పోస్ట్ లో ఈ విధంగా వ్రాయబడింది: తలనొప్పికి ఉపశమనం. ఈసారి మీకు తలనొప్పి వస్తే, 10-12 బాదాములు తినండి, ఇవి రెండు ఆస్పిరిన్ మాత్రలకు సమానం.”""",2022-4-10,Vishvanews,,"""తలనొప్పికి ఆస్పిరిన్ కంటే బాదాములు బాగా పనిచేస్తాయి అని క్లెయిమ్ చేసే వైరల్ పోస్ట్ తప్పుదోవపట్టించేది. ఆస్పిరిన్ కు బదులుగా బాదాములను ఉపయోగించవచ్చు అని ధృవీకరించటానికి ఎలాంటి శాస్త్రీయ రుజువు లేదు.""","""['https://medlineplus.gov/druginfo/meds/a682878.html', 'https://pubmed.ncbi.nlm.nih.gov/11714873/', 'https://www.sciencedirect.com/topics/neuroscience/salicylates#:~:text=The%20overuse%20of%20salicylates%20in%20all%20forms%20may%20cause%20headache.', 'https://www.slhd.nsw.gov.au/rpa/allergy/research/salicylatesinfoods.pdf', 'https://thejournalofheadacheandpain.biomedcentral.com/articles/10.1186/s10194-019-1057-1']""","""వాస్తవ తనిఖీ: తలనొప్పి కోసం ఆస్పిరిన్ కంటే బాదాములు బాగా పనిచేస్తాయి అని క్లెయిమ్ చేసే పోస్ట్ తప్పుదోవపట్టించేది""","""['Fact Check']""",,,,,
138,,,,False,"""सियासत भदोड़ की""",,,Vishvanews,,https://www.vishvasnews.com/marathi/viral/fact-check-actor-dharmendra-is-fit-and-fine-viral-claim-is-fake/,"""धर्मेंद्र का निधन""",2022-6-21,Vishvanews,,"""विश्वास न्यूजच्या तपासात व्हायरल दावा खोटा असल्याचे कळले. विश्वास न्यूजच्या तपासात धर्मेंद्र पूर्णपणे निरोगी असल्याचे आढळून आले. त्यांच्या मृत्यूबाबत व्हायरल होत असलेली पोस्ट खोटी आहे. हे वृत्त लिहेपर्यंत अशी कोणतीही बातमी कुठेही आढळून आली नाही.""","""['https://www.facebook.com/112559027231183/photos/a.116440213509731/532065758613839/', 'https://perma.cc/7WPZ-6XC5', 'https://www.news9live.com/entertainment/bollywood/sunny-deol-bobby-deol-dismiss-reports-of-dharmendra-deteriorating-health-174749', 'https://twitter.com/bombaytimes/status/1538808976850448384']""","""Fact Check: अभिनेते धर्मेंद्र अगदी व्यवस्थित आहेत, त्यांच्या मृत्यू ची अफवा उडवणारी पोस्ट खोटी""","""['Actor', 'Bollywood actor Dharmendra', 'Dharmendra', 'Fact Check', 'fake news']""",,,,,
139,,,,False,"""Whatsapp User""",,,Vishvanews,,https://www.vishvasnews.com/marathi/society/fact-check-no-scheme-by-the-name-pm-ramban-yojana-link-could-lead-to-fraud/,"""प्रधानमंत्री रामबाण सुरक्षा योजना* के लिए रजिस्ट्रेशन हो रहा है, इस योजना के अंतर्गत सभी युवाओं को 4000 रूपये की मदद राशि मिलेगी।नीचे दी गयी लिंक से अभी रजिस्ट्रेशन करें""",2022-6-21,Vishvanews,,"""‘पीएम रामबाण योजना’ च्या अंतर्गत 4,000 रुपये देण्याचा दावा करणारा मेसेज खोटा आहे. शासनातर्फे अशी कुठलीच योजना लागू करण्यात आली नाही आहे.""","""['https://www.india.gov.in/my-government/schemes', 'https://twitter.com/narendramodi', 'https://twitter.com/PMOIndia']""","""Fact Check: ‘PM रामबाण योजना’ सारखी कुठली योजना नाही, व्हायरल लिंक ने फसवणूक होण्याची शक्यता आहे""","""['Fact Check', 'fake news', 'PM Narendra Modi', 'PM Ramban Yojana']""",,,,,
140,,,,False,"""‘हिंदुत्व से बढ़कर कोई धर्म नहीं “गौ गीता गंगा और गायत्री’""",,,Vishvanews,,https://www.vishvasnews.com/marathi/society/fact-check-viral-tweet-in-the-name-of-rahul-gandhi-is-fake/,"""राहुल गांधी चे ट्विट""",2022-6-20,Vishvanews,,"""विश्वास न्यूज च्या तपासात कळले कि राहुल गांधी ह्यांच्या नावाने व्हायरल होत असलेले ट्विट फेक आहे.""","""['https://www.facebook.com/gaugeetagangaaurgaytri/posts/pfbid02hh6zkyjvgcz8SBXJ7npaezu7J2Jd8LtyT1PupFZ4GJvLTQuMS2TMdHh3YPrcasGMl', 'https://perma.cc/QFE3-VSQZ']""","""Fact Check: ईडी ला घेऊन राहुल गांधींनी नाही केले हे ट्विट""","""['Agnipath Scheme', 'BJP', 'Congress', 'Fact Check', 'fake news', 'Rahul Gandhi']""",,,,,
