,rating_ratingValue,rating_worstRating,rating_bestRating,rating_alternateName,creativeWork_author_name,creativeWork_datePublished,creativeWork_author_sameAs,claimReview_author_name,claimReview_author_url,claimReview_url,claimReview_claimReviewed,claimReview_datePublished,claimReview_source,claimReview_author,extra_body,extra_refered_links,extra_title,extra_tags,extra_entities_claimReview_claimReviewed,extra_entities_body,extra_entities_keywords,extra_entities_author,related_links
0,,,,False,"""Revan Siddappa""",,,Vishvanews,,https://www.vishvasnews.com/english/politics/fact-check-shiv-sena-leader-and-mla-aaditya-thackeray-did-not-drop-minister-from-twitter-bio-viral-claims-are-false/,"""Aaditya Thackeray drops minister from his Twitter bio""",2022-6-22,Vishvanews,,"""Vishvas News in its investigation found the viral claim to be fake. Shiv Sena leader and MLA Aaditya Thackeray has not dropped ‘minister’ position from his Twitter bio.""","""['https://twitter.com/ShivSena?ref_src=twsrc%5Etfw', 'https://twitter.com/AUThackeray?ref_src=twsrc%5Etfw', 'https://twitter.com/hashtag/MaharashtraPoliticalCrisis?src=hash&ref_src=twsrc%5Etfw', 'https://twitter.com/hashtag/AadityaThackeray?src=hash&ref_src=twsrc%5Etfw', 'https://twitter.com/hashtag/EknathShinde?src=hash&ref_src=twsrc%5Etfw', 'https://twitter.com/hashtag/UddhavThackeray?src=hash&ref_src=twsrc%5Etfw', 'https://twitter.com/hashtag/Shivsena?src=hash&ref_src=twsrc%5Etfw', 'https://twitter.com/hashtag/ShivsenaMLA?src=hash&ref_src=twsrc%5Etfw', 'https://twitter.com/hashtag/SharadPawar?src=hash&ref_src=twsrc%5Etfw', 'https://t.co/gYID8a2bxi', 'https://www.esakal.com/maharashtra/aditya-thackeray-deleted-the-mention-of-ministerial-post-from-twitter-political-crisis-in-maharashtra-dro95-2', 'https://www.financialexpress.com/india-news/maharashtra-political-crisis-aaditya-thackeray-removes-minister-from-twitter-bio-shiv-sena-says-might-be-out-of-frustration/2568880/', 'https://www.facebook.com/photo/?fbid=5353245214757537&set=a.226434870771956', 'https://web.archive.org/web/20220622070702/https://www.facebook.com/photo/?fbid=5353245214757537&set=a.226434870771956', 'https://t.co/4nb0c38dNR', 'https://t.co/SvNksWjwcA', 'https://twitter.com/AUThackeray?ref_src=twsrc%5Etfw', 'https://twitter.com/hashtag/EknathShinde?src=hash&ref_src=twsrc%5Etfw', 'https://twitter.com/hashtag/MaharashtraPoliticalTurmoil?src=hash&ref_src=twsrc%5Etfw', 'https://t.co/zFto0Q5EPz', 'https://t.co/mzg6CMFjUZ', 'https://web.archive.org/web/20220428195419/https://twitter.com/AUThackeray', 'https://web.archive.org/web/20220613061404/https://twitter.com/AUThackeray']""","""Fact Check: Shiv Sena leader and MLA Aaditya Thackeray did not drop ‘minister’ from Twitter bio, viral claims are false""","""['Aaditya Thackeray', 'BJP', 'Fact Check', 'fake news', 'Maharashtra politics', 'MVA', 'Shiv Sena']""",,,,,
1,,,,False,"""सियासत भदोड़ की""",,,Vishvanews,,https://www.vishvasnews.com/english/politics/fact-check-actor-dharmendra-is-alive-rumor-about-his-death-is-fake/,"""धर्मेंद्र का निधन""",2022-6-22,Vishvanews,,"""Vishvas News in its investigation found that this claim is false. Dharmendra is completely healthy. The post going viral about his death is fake. Till the time we wrote this report, we did not get any news of Dharmendra’s death.""","""['https://www.facebook.com/112559027231183/photos/a.116440213509731/532065758613839/', 'https://perma.cc/7WPZ-6XC5', 'https://www.news9live.com/entertainment/bollywood/sunny-deol-bobby-deol-dismiss-reports-of-dharmendra-deteriorating-health-174749', 'https://twitter.com/aapkadharam']""","""Fact Check: Actor Dharmendra is alive, rumor about his death is fake""","""['Bollywood actor Dharmendra', 'Dharmendra', 'Dharmendra Deol', 'Fact Check', 'fake news']""",,,,,
2,,,,Misleading,"""Zaib Ali""",,,Vishvanews,,https://www.vishvasnews.com/english/politics/fact-check-kerala-student-leader-aysha-rennas-picture-goes-viral-in-the-name-of-journalist-rana-ayyub/,"""Jinnah was always right ..what a brave girl ..salute to her courage RanaAyyub may ALLAH be with her""",2022-6-21,Vishvanews,,"""The viral claim turned out to be false in the investigation of Vishvas News. The woman in the picture is not journalist Rana Ayyub, but Aysha Renna, the leader of the Fraternity Movement. She was caught by the Kerala Police during a highway blockade in Malappuram district on June 12, 2022.""","""['https://www.facebook.com/photo/?fbid=170791545413202&set=a.170133848812305', 'https://perma.cc/DZL6-B9PG', 'https://www.facebook.com/fraternitymovementkerala/posts/385294150302816', 'https://www.facebook.com/fraternitymovementkerala/posts/385294150302816', 'https://www.facebook.com/photo.php?fbid=5137739469636480&set=a.457919537618520&type=3', 'https://www.youtube.com/watch?v=Ep1zzPdX7AI', 'https://www.youtube.com/embed/Ep1zzPdX7AI?feature=oembed']""","""Fact Check: Kerala student leader Aysha Renna’s picture goes viral in the name of journalist Rana Ayyub""","""['Fact Check', 'fake news', 'Rana Ayyub', 'UP Goverment']""",,,,,
3,,,,Misleading,"""Amit Kamboj""",,,Vishvanews,,https://www.vishvasnews.com/english/politics/fact-check-azam-khans-statement-from-5-years-ago-being-shared-in-wrong-context/,"""कुछ लोग कहते हैं कि योगी जी ने कुछ नही किया। ये आजम खां 27 महीने जेल में रहकर आया है और जेल से बाहर आते ही इसे अपने आदर्श भगवान राम और भगवान कृष्ण दिखने लगे हैं। योगी जी का अंदाज ही निराला है""",2022-6-20,Vishvanews,,"""In the investigation of Vishvas News, the claim being made about Azam Khan’s viral video turned out to be misleading. The video is not recent, but from the year 2017.""","""['https://www.facebook.com/permalink.php?story_fbid=3228353864158183&id=100009508021958', 'https://perma.cc/7HEF-7RWN', 'https://www.youtube.com/watch?v=YrnSrZTT_bg&feature=emb_title', 'https://www.abplive.com/news/states/sp-leader-azam-khan-attacks-on-pm-modi-and-cm-yogi-702162', 'https://www.youtube.com/embed/YrnSrZTT_bg?feature=oembed']""","""Fact Check: Azam Khan’s statement from 5 years ago being shared in wrong context""","""['Azam Khan', 'Azam Khan News', 'Azam Khan video', 'Fact Check', 'fake news', 'Samajwadi party']""",,,,,
4,,,,False,"""Whatsapp User""",,,Vishvanews,,https://www.vishvasnews.com/english/politics/fact-check-there-is-no-scheme-like-pm-ramban-yojana-viral-links-can-lead-to-fraud/,"""प्रधानमंत्री रामबाण सुरक्षा योजना* के लिए रजिस्ट्रेशन हो रहा है, इस योजना के अंतर्गत सभी युवाओं को 4000 रूपये की मदद राशि मिलेगी।नीचे दी गयी लिंक से अभी रजिस्ट्रेशन करें""",2022-6-20,Vishvanews,,"""Messages and posts claiming to be giving Rs 4,000 under ‘PM Ramban Yojana’ are fake. No such scheme has been implemented by the government.""","""['https://www.blogger.com/blogin.g?blogspotURL=https://ww7-ramban-suraksha-yojna.blogspot.com/?m%3D1%26fbclid%3DIwAR2gztXkzU3B__k7yKYJPTkVyjqkFtgm7usME0fm6_wcWvhMf2q7eux9YGE&type=blog&bpli=1&pli=1#:~:text=Share%20with%20your-,groups,-0%25', 'https://www.india.gov.in/my-government/schemes', 'https://twitter.com/PMOIndia', 'https://twitter.com/PMOIndia']""","""Fact Check: There is no scheme like ‘PM Ramban Yojana’, viral links can lead to fraud""","""['Fact Check', 'fake news', 'PM Modi', 'PM Ramban Yojana']""",,,,,
5,,,,False,"""Revan Siddappa""",,,Vishvanews,,https://www.vishvasnews.com/english/politics/fact-check-shiv-sena-leader-and-mla-aaditya-thackeray-did-not-drop-minister-from-twitter-bio-viral-claims-are-false/,"""Aaditya Thackeray drops minister from his Twitter bio""",2022-6-22,Vishvanews,,"""Vishvas News in its investigation found the viral claim to be fake. Shiv Sena leader and MLA Aaditya Thackeray has not dropped ‘minister’ position from his Twitter bio.""","""['https://twitter.com/ShivSena?ref_src=twsrc%5Etfw', 'https://twitter.com/AUThackeray?ref_src=twsrc%5Etfw', 'https://twitter.com/hashtag/MaharashtraPoliticalCrisis?src=hash&ref_src=twsrc%5Etfw', 'https://twitter.com/hashtag/AadityaThackeray?src=hash&ref_src=twsrc%5Etfw', 'https://twitter.com/hashtag/EknathShinde?src=hash&ref_src=twsrc%5Etfw', 'https://twitter.com/hashtag/UddhavThackeray?src=hash&ref_src=twsrc%5Etfw', 'https://twitter.com/hashtag/Shivsena?src=hash&ref_src=twsrc%5Etfw', 'https://twitter.com/hashtag/ShivsenaMLA?src=hash&ref_src=twsrc%5Etfw', 'https://twitter.com/hashtag/SharadPawar?src=hash&ref_src=twsrc%5Etfw', 'https://t.co/gYID8a2bxi', 'https://www.esakal.com/maharashtra/aditya-thackeray-deleted-the-mention-of-ministerial-post-from-twitter-political-crisis-in-maharashtra-dro95-2', 'https://www.financialexpress.com/india-news/maharashtra-political-crisis-aaditya-thackeray-removes-minister-from-twitter-bio-shiv-sena-says-might-be-out-of-frustration/2568880/', 'https://www.facebook.com/photo/?fbid=5353245214757537&set=a.226434870771956', 'https://web.archive.org/web/20220622070702/https://www.facebook.com/photo/?fbid=5353245214757537&set=a.226434870771956', 'https://t.co/4nb0c38dNR', 'https://t.co/SvNksWjwcA', 'https://twitter.com/AUThackeray?ref_src=twsrc%5Etfw', 'https://twitter.com/hashtag/EknathShinde?src=hash&ref_src=twsrc%5Etfw', 'https://twitter.com/hashtag/MaharashtraPoliticalTurmoil?src=hash&ref_src=twsrc%5Etfw', 'https://t.co/zFto0Q5EPz', 'https://t.co/mzg6CMFjUZ', 'https://web.archive.org/web/20220428195419/https://twitter.com/AUThackeray', 'https://web.archive.org/web/20220613061404/https://twitter.com/AUThackeray']""","""Fact Check: Shiv Sena leader and MLA Aaditya Thackeray did not drop ‘minister’ from Twitter bio, viral claims are false""","""['Aaditya Thackeray', 'BJP', 'Fact Check', 'fake news', 'Maharashtra politics', 'MVA', 'Shiv Sena']""",,,,,
6,,,,Misleading,"""Newwave Bgf Ko Ko""",,,Vishvanews,,https://www.vishvasnews.com/english/world/fact-check-video-being-shared-as-test-launch-of-brahmos-missile-in-myanmar-is-from-india/,"""Myanmar missile test launch""",2022-6-16,Vishvanews,,"""Video going viral as test-launch of missile in Myanmar is that of India. The claim is misleading.""","""['https://www.facebook.com/100077853661964/videos/445010857421291/', 'https://web.archive.org/web/20220616063330/https://www.facebook.com/100077853661964/videos/445010857421291/', 'https://www.facebook.com/photo?fbid=113784734615178&set=pcb.113784847948500', 'https://www.facebook.com/photo?fbid=347592557386345&set=pcb.347592730719661', 'https://twitter.com/hashtag/WATCH?src=hash&ref_src=twsrc%5Etfw', 'https://twitter.com/hashtag/BRAHMOS?src=hash&ref_src=twsrc%5Etfw', 'https://t.co/P7oscQqxzm', 'https://t.co/Ztu1G3z0eo', 'https://twitter.com/hashtag/Brahmos?src=hash&ref_src=twsrc%5Etfw', 'https://t.co/9RaXaghFem', 'https://t.co/DizprICpOT', 'https://frontline.thehindu.com/dispatches/india-successfully-tests-extended-range-version-of-brahmos-cruise-missile-from-andaman-and-nicobar-islands/article65273961.ece', 'https://www.ndtv.com/india-news/watch-video-of-brahmos-extended-range-surface-to-surface-missile-test-in-andaman-2840701']""","""Fact check: Video being shared as test-launch of BrahMos missile in Myanmar, is from India""","""['BrahMos missile', 'Fact Check', 'fake news', 'Myanmar']""",,,,,
7,,,,False,"""Lord Miles Routledge Adventures""",,,Vishvanews,,https://www.vishvasnews.com/english/viral/fact-check-viral-cnn-tweet-is-fabricated/,"""Tweet by CNN""",2022-6-14,Vishvanews,,"""The viral CNN tweet screenshot is fabricated. CNN did not do such story on China.""","""['https://twitter.com/real_lord_miles/status/1533133043510157315', 'https://web.archive.org/web/20220610094648/https://twitter.com/real_lord_miles/status/1533133043510157315', 'https://twitter.com/CNN', 'https://twitter.com/search?q=A%20leaked%20Chinese%20geopolitical%20strategy%20document%20reveals%20China%27s%20self-confidence.%20The%20document%20predicts%2C%22The%20US%20and%20Western%20Europe%20will%20collapse%20due%20to%20cultural%20and%20demographic%20conflict%20by%202050.%22%20China%27s%20leaders%20increasingly%20see%20multiculturalism%20as%20%22cultural%20suicide%22%20and%20believe%20the%20west%20is%20dying%20because%20of%20it.&src=typed_query']""","""Fact check: Viral CNN’s tweet about China is fabricated""","""['China', 'CNN', 'Fact Check', 'fake news']""",,,,,
8,,,,False,"""Fox Sports Radio 1400 Texarkana""",,,Vishvanews,,https://www.vishvasnews.com/english/society/fact-check-old-picture-of-a-crowded-river-in-finland-is-being-shared-with-the-claim-that-it-is-from-the-us/,"""Guadalupe River in New Braunsfel, Tx this weekend.""",2022-6-14,Vishvanews,,"""The viral claim turned out to be false in the investigation of Vishvas News. The picture has nothing to do with America, the viral picture is from Finland.""","""['https://www.facebook.com/FoxSportsRadio1400Texarkana/posts/51584983444264844', 'https://www.facebook.com/ViralEntertainment001/posts/4092151114242895', 'https://www.facebook.com/passionentertainment2016/posts/1661978450853607', 'https://perma.cc/6EHX-6RQP', 'https://twitter.com/DiscoverFinland/status/890537733466316800', 'https://perma.cc/Q4VV-RDH9', 'https://www.kaljakellunta.org/en/photos/']""","""Fact Check: Old picture of a crowded river in Finland is being shared with the claim that it is from the US""","""['Fact Check']""",,,,,
9,,,,False,"""R Rajagopalan""",,,Vishvanews,,https://www.vishvasnews.com/english/politics/fact-check-morphed-image-from-up-of-people-hoisting-bjp-flag-over-a-pole-goes-viral-as-tamil-nadu/,"""In a remote village Osur in Tamil Nadu. Best picture of this week. Not only cadre based BJP. It is Ladder based Party. No Dynast""",2022-6-9,Vishvanews,,"""Viral image claiming that the human pyramid hoisted a BJP flag in Tamil Nadu is fake. The image originally has a BSP flag and is not from Tamil Nadu but from Shahpur, Uttar Pradesh clicked during the 2017 UP elections.""","""['https://twitter.com/PrajwalBusta/status/1534053353348399104', 'https://archive.ph/i5sUa', 'https://web.archive.org/web/20220608151234/https://twitter.com/RAJAGOPALAN1951/status/1534022907512229888', 'https://t.co/767XDl98g1', 'https://twitter.com/RSPraveenSwaero?ref_src=twsrc%5Etfw', 'https://twitter.com/Mayawati?ref_src=twsrc%5Etfw', 'https://twitter.com/AnandAkash_BSP?ref_src=twsrc%5Etfw', 'https://twitter.com/ramjigautambsp?ref_src=twsrc%5Etfw', 'https://t.co/gkLh8FnnBz', 'https://twitter.com/BSP4Telangana?ref_src=twsrc%5Etfw', 'https://t.co/b7u0zHUnho']""","""Fact Check: This picture of people waving BJP flag on a pole is edited; The original picture is of Uttar Pradesh and the flag was of BSP.""","""['BJP', 'BSP', 'Fact Check', 'fake news', 'Telangana', 'Uttar Pradesh']""",,,,,
10,,,,Misleading,"""Newwave Bgf Ko Ko""",,,Vishvanews,,https://www.vishvasnews.com/english/world/fact-check-video-being-shared-as-test-launch-of-brahmos-missile-in-myanmar-is-from-india/,"""Myanmar missile test launch""",2022-6-16,Vishvanews,,"""Video going viral as test-launch of missile in Myanmar is that of India. The claim is misleading.""","""['https://www.facebook.com/100077853661964/videos/445010857421291/', 'https://web.archive.org/web/20220616063330/https://www.facebook.com/100077853661964/videos/445010857421291/', 'https://www.facebook.com/photo?fbid=113784734615178&set=pcb.113784847948500', 'https://www.facebook.com/photo?fbid=347592557386345&set=pcb.347592730719661', 'https://twitter.com/hashtag/WATCH?src=hash&ref_src=twsrc%5Etfw', 'https://twitter.com/hashtag/BRAHMOS?src=hash&ref_src=twsrc%5Etfw', 'https://t.co/P7oscQqxzm', 'https://t.co/Ztu1G3z0eo', 'https://twitter.com/hashtag/Brahmos?src=hash&ref_src=twsrc%5Etfw', 'https://t.co/9RaXaghFem', 'https://t.co/DizprICpOT', 'https://frontline.thehindu.com/dispatches/india-successfully-tests-extended-range-version-of-brahmos-cruise-missile-from-andaman-and-nicobar-islands/article65273961.ece', 'https://www.ndtv.com/india-news/watch-video-of-brahmos-extended-range-surface-to-surface-missile-test-in-andaman-2840701']""","""Fact check: Video being shared as test-launch of BrahMos missile in Myanmar, is from India""","""['BrahMos missile', 'Fact Check', 'fake news', 'Myanmar']""",,,,,
11,,,,False,"""Lord Miles Routledge Adventures""",,,Vishvanews,,https://www.vishvasnews.com/english/viral/fact-check-viral-cnn-tweet-is-fabricated/,"""Tweet by CNN""",2022-6-14,Vishvanews,,"""The viral CNN tweet screenshot is fabricated. CNN did not do such story on China.""","""['https://twitter.com/real_lord_miles/status/1533133043510157315', 'https://web.archive.org/web/20220610094648/https://twitter.com/real_lord_miles/status/1533133043510157315', 'https://twitter.com/CNN', 'https://twitter.com/search?q=A%20leaked%20Chinese%20geopolitical%20strategy%20document%20reveals%20China%27s%20self-confidence.%20The%20document%20predicts%2C%22The%20US%20and%20Western%20Europe%20will%20collapse%20due%20to%20cultural%20and%20demographic%20conflict%20by%202050.%22%20China%27s%20leaders%20increasingly%20see%20multiculturalism%20as%20%22cultural%20suicide%22%20and%20believe%20the%20west%20is%20dying%20because%20of%20it.&src=typed_query']""","""Fact check: Viral CNN’s tweet about China is fabricated""","""['China', 'CNN', 'Fact Check', 'fake news']""",,,,,
12,,,,False,"""Fox Sports Radio 1400 Texarkana""",,,Vishvanews,,https://www.vishvasnews.com/english/society/fact-check-old-picture-of-a-crowded-river-in-finland-is-being-shared-with-the-claim-that-it-is-from-the-us/,"""Guadalupe River in New Braunsfel, Tx this weekend.""",2022-6-14,Vishvanews,,"""The viral claim turned out to be false in the investigation of Vishvas News. The picture has nothing to do with America, the viral picture is from Finland.""","""['https://www.facebook.com/FoxSportsRadio1400Texarkana/posts/51584983444264844', 'https://www.facebook.com/ViralEntertainment001/posts/4092151114242895', 'https://www.facebook.com/passionentertainment2016/posts/1661978450853607', 'https://perma.cc/6EHX-6RQP', 'https://twitter.com/DiscoverFinland/status/890537733466316800', 'https://perma.cc/Q4VV-RDH9', 'https://www.kaljakellunta.org/en/photos/']""","""Fact Check: Old picture of a crowded river in Finland is being shared with the claim that it is from the US""","""['Fact Check']""",,,,,
13,,,,False,"""Prashant Tewari""",,,Vishvanews,,https://www.vishvasnews.com/english/viral/fact-check-video-of-digital-art-passed-off-as-rare-plant-oodhu-paavai-found-in-tamil-nadu/,"""तमिलनाडु मे पाए जाना वाले इस पौधे को उधु पवई के नाम से जाना जाता हैं, यह विशेष रूप से वर्षा वन मे उगता हैं! यह एक औषधी पौधा हैं जो अपने परागकाणो को ध्वनि से उड़ाया हैं! ऐतिहासिक रेल इंजिन की तरह""",2022-6-7,Vishvanews,,"""The viral claim turned out to be false in the investigation of Vishvas News. The viral video has been created by a UK-based designer using editing software.""","""['https://www.facebook.com/prashant.tewari.100/posts/2626427127490204/', 'https://perma.cc/P8J2-HJ34', 'https://twitter.com/eLPenry/status/1438895987431559168', 'https://foundation.app/@LukePenry/foundation/90730', 'https://twitter.com/eLPenry/status/1443005029351309314', 'https://www.instagram.com/p/CUVsWWkF8_S/', 'https://twitter.com/hashtag/nftart?src=hash&ref_src=twsrc%5Etfw', 'https://t.co/SVFvtwtQrp']""","""Fact Check : Video of digital art passed off as rare plant ‘Oodhu Paavai’ found in Tamil Nadu""","""['Fact Check', 'fake news', 'Oodhu Paavai', 'Oodhu Paavai video', 'plant video', 'viral video']""",,,,,
14,,,,Misleading,"""Habib Qureshi""",,,Vishvanews,,https://www.vishvasnews.com/english/viral/fact-check-mohammad-rafis-song-jannat-ki-hai-picture-was-not-banned-misleading-claim-goes-viral/,"""मुसलमानों ने माफी नहीं मांगी 50, हजार उलेमाओं को एक साथ पेड़ों पर लटका कर फांसी दी गई अंग्रेजों द्वारा कहते हैं मोहम्मद रफी के गाए इस गाने पर पाकिस्तान को आपत्ति हुई और उसने भारत सरकार से इस गाने पर प्रतिबंध लगाने के लिए कहा गया था और हमारी सरकार ने उस समय इस गाने पर प्रतिबंध लगा दिया था, यह एक दुर्लभ गीत है, शायद आपने कभी सुना नहीं होगा, एक बार पूरा सुने ||""",2022-5-30,Vishvanews,,"""The viral claim about Mohammad Rafi’s song turned out to be misleading. The lines of this song were changed by the censor board. The song was not banned.""","""['https://www.facebook.com/habib.qureshi.37266136/posts/1062191634654185/', 'https://perma.cc/LVW4-BNNJ', 'https://www.youtube.com/watch?time_continue=9&v=Cb8kptCEcjo&feature=emb_title', 'https://www.youtube.com/embed/Cb8kptCEcjo?start=9&feature=oembed']""","""Fact Check: Mohammad Rafi’s song ‘Jannat ki hai Tasveer’ was not banned, misleading claim goes viral""","""['Fact Check', 'fake news', 'Jannat ki hai Tasveer', 'Mohammad Rafi']""",,,,,
15,,,,Misleading,"""Fb user: Barry Wuthrich""",,,Vishvanews,,https://www.vishvasnews.com/english/health/fact-check-misused-photo-in-viral-post-doesnt-prove-that-monkeypox-is-a-hoax-viral-post-is-misleading/,"""Let the monkeypox hoax begin. After all, we haven't had a good pandemic hoax since the last election.""",2022-5-30,Vishvanews,,"""Misused photo in viral post doesn’t prove that monkeypox is a hoax; viral post is misleading.""","""['https://perma.cc/HT5Y-26MQ', 'https://archive.md/Dzv1t', 'https://archive.md/wip/QXmiP', 'https://web.archive.org/web/20220520172647/https://www.thehealthsite.com/diseases-conditions/rare-monkeypox-cases-reported-from-us-first-time-in-nearly-20-years-all-you-need-to-know-about-it-826374/', 'https://247newsaroundtheworld.com/diseases/rare-monkeypox-cases-reported-from-us-first-time-in-nearly-20-years-all-you-need-to-know-about-it/', 'https://www.cdc.gov/media/releases/2021/s0716-confirm-monkeypox.html', 'https://www.who.int/emergencies/disease-outbreak-news/item/2022-DON385']""","""Fact Check: Misused photo in viral post doesn’t prove that monkeypox is a hoax; viral post is misleading""","""['Fact Check', 'monkeypox']""",,,,,
16,,,,False,"""FB Page: Key Detox Life""",,,Vishvanews,,https://www.vishvasnews.com/english/health/fact-check-color-from-photo-of-the-shoe-doesnt-reveal-youre-right-or-left-brain-dominant/,"""Right and left brain dominant, if ur right brain is dominant, u will see combination of pink and white color, and if ur left brain is dominant, u will see it in grey and green color. Try with ur loved ones, very interesting.”""",2022-5-12,Vishvanews,,"""The post claiming you are right- or left-brain dominant depending on the colors you see in the sneaker is fake.""","""['https://perma.cc/TPJ4-WD23', 'https://www.instagram.com/p/B3kGYs6BOJP/?utm_source=ig_embed', 'https://people.com/style/vans-sneakers-color-debate-pink-and-white-teal-and-grey/', 'https://www.health.com/mind-body/sneaker-optical-illusion', 'https://www.health.com/mind-body/sneaker-optical-illusion', 'https://jov.arvojournals.org/article.aspx?articleid=2600950#151450532', 'https://www.discovermagazine.com/the-sciences/doublethink']""","""Fact Check: Color from photo of the shoe doesn’t reveal you’re right or left-brain dominant""","""['Brain', 'Fact Check', 'fake news', 'Neurology']""",,,,,
17,,,,Misleading,"""FB page: Nutritionist Alizay khattak""",,,Vishvanews,,https://www.vishvasnews.com/english/health/fact-check-post-claiming-almonds-work-better-than-aspirin-for-headaches-is-misleading/,"""A social media post reads: “HEADACHE REMEDY. Eat 10-12 almonds, the equivalent of two aspirins, next time you have a headache.”""",2022-3-28,Vishvanews,,"""Viral post claiming almonds work better than aspirin for headaches is misleading. There is no scientific evidence that confirms almonds can replace aspirin.""","""['https://www.facebook.com/permalink.php?story_fbid=129941552772413&id=106324985134070', 'https://perma.cc/FWP3-65MG', 'https://medlineplus.gov/druginfo/meds/a682878.html', 'https://pubmed.ncbi.nlm.nih.gov/11714873/', 'https://www.sciencedirect.com/topics/neuroscience/salicylates#:~:text=The%20overuse%20of%20salicylates%20in%20all%20forms%20may%20cause%20headache.', 'https://www.slhd.nsw.gov.au/rpa/allergy/research/salicylatesinfoods.pdf', 'https://www.researchgate.net/profile/Jihene-Ben-Ghnia/publication/342153576_Almond_Purunus_amygdalus_L_A_review_on_health_benefits_nutritional_value_and_therapeutic_applications/links/5ee50b1792851ce9e7e201ed/Almond-Purunus-amygdalus-L-A-review-on-health-benefits-nutritional-value-and-therapeutic-applications.pdf', 'https://thejournalofheadacheandpain.biomedcentral.com/articles/10.1186/s10194-019-1057-1']""","""Fact Check: Post claiming almonds work better than aspirin for headaches is misleading""","""['headaches', 'health', 'health fact check']""",,,,,
