,rating_ratingValue,rating_worstRating,rating_bestRating,rating_alternateName,creativeWork_author_name,creativeWork_datePublished,creativeWork_author_sameAs,claimReview_author_name,claimReview_author_url,claimReview_url,claimReview_claimReviewed,claimReview_datePublished,claimReview_source,claimReview_author,extra_body,extra_refered_links,extra_title,extra_tags,extra_entities_claimReview_claimReviewed,extra_entities_body,extra_entities_keywords,extra_entities_author,related_links
99,,,,False,"""ફેસબુક યુઝર દીપક ખત્રી""",,,Vishvanews,,https://www.vishvasnews.com/gujarati/politics/fact-check-this-picture-of-prime-minister-modi-is-edited-fake-picture-goes-viral/,"""ગુલામોના માથા નમાવતા માલિકના ઘરનું સરનામું છતી કરે છે!""",2022-6-8,Vishvanews,,"""વિશ્વાસ ન્યૂઝની તપાસમાં પીએમ મોદી અને નીતા અંબાણીના નામની વાયરલ તસવીર નકલી નીકળી. આ એક મોર્ફ્ડ ચિત્ર છે. મૂળ તસવીરમાં દીપિકા મંડલ દિલ્હીમાં એક સામાજિક સંસ્થા ચલાવી રહી છે.""","""['https://perma.cc/5BUT-SXQ5', 'https://www.vtvgujarati.com/news-details/pm-narendra-modi-greeting-deepika-mandal', 'https://hindi.oneindia.com/news/india/pm-modi-bow-down-this-women-know-who-is-she-451836.html']""","""Fact Check : વડાપ્રધાન મોદીની આ તસવીર એડિટ કરવામાં આવી છે, આ તસવીર પ્રચારના ઈરાદાથી વાયરલ કરવામાં આવી છે""","""['Fact Check', 'Nita Ambani', 'PM Modi']""",,,,,
100,,,,False,"""Binod Singh""",,,Vishvanews,,https://www.vishvasnews.com/gujarati/politics/fact-check-in-this-4-year-old-video-pm-modi-was-talking-about-manik-sarkar-not-manik-saha-claim-is-fake/,"""ગપ્પુજીનો દરેક વીડિયો મારી પાસે ઉપલબ્ધ છે, મોદીજીએ 4 વર્ષ પહેલા ત્રિપુરાના લોકોને કહ્યું હતું:- હવે તમને માણિક સાહા નથી જોઈતા, માણિક સાહા પાસેથી આઝાદી લો. હવે તમારે હીરાની જરૂર છે, હીરા જોઈએ છે કે નહીં? આજે ભાજપે ત્રિપુરાના મુખ્યમંત્રી અને રાજ્યસભાના સાંસદ ડો. માણિક સાહાને ત્રિપુરાના નવા મુખ્યમંત્રી તરીકે ચૂંટ્યા છે.""",2022-5-31,Vishvanews,,"""વિશ્વાસ ન્યૂઝે તેની તપાસમાં જાણવા મળ્યું કે આ દાવો ભ્રામક છે. વાસ્તવમાં પીએમ મોદી માણિક સાહા નહીં પણ માણિક સરકારની વાત કરી રહ્યા હતા.""","""['https://www.facebook.com/binod.singh.7549/posts/4642584689181602', 'https://www.jagran.com/politics/national-pm-modi-will-address-two-political-rallies-in-tripura-today-17482496.html']""","""Fact Check: PM મોદીએ ચૂંટણી ભાષણમાં પૂર્વ CM માણિક સરકાર પર નિશાન સાધ્યું, માણિક સાહાના નામે થઈ રહ્યો વીડિયો વાયરલ""","""['Fact Check', 'PM Modi']""",,,,,
101,,,,False,"""ફેસબુક યુઝર જયકિશન ગોયલ BJP""",,,Vishvanews,,https://www.vishvasnews.com/gujarati/politics/fact-check-photo-of-congress-udaipur-chintan-shivir-getting-viral-with-misleading-claim-2/,"""રાજસ્થાનના ઉદયપુરમાં ચાલી રહેલા કોંગ્રેસ પાર્ટીના ચિંતન શિવરની આ તસવીર છે!! જેમાં પાકિસ્તાનના રાષ્ટ્રધ્વજનો રંગ ચઢાવવામાં આવ્યો છે અને ભગવો રંગ નીચે મૂકવામાં આવ્યો છે.""",2022-5-28,Vishvanews,,"""વિશ્વ ન્યૂઝની તપાસમાં વાયરલ પોસ્ટ ગેરમાર્ગે દોરનારી સાબિત થઈ. કોંગ્રેસના ઉદયપુર ચિંતન શિબિરમાં પાર્ટીના રંગીન કપડાંનો ઉપયોગ કરીને સ્થળને શણગારવામાં આવ્યું હતું.""","""['https://www.facebook.com/goyaljaikishan/posts/421010630024670', 'https://t.co/f36hChOv85', 'https://t.co/hBRs1wv3LP']""","""Fact Check : કોંગ્રેસના ઉદયપુર ચિંતન શિવરની તસવીર ભ્રામક દાવાઓ સાથે વાયરલ થઈ હતી""","""['Congress', 'Fact Check']""",,,,,
102,,,,False,"""Virag Pandey""",,,Vishvanews,,https://www.vishvasnews.com/gujarati/politics/fact-check-mysterious-gold-chariot-found-in-srikakulam-sea-at-andhra-pradesh-is-misleading-in-nature/,"""મંદિરના આકારનો સુવર્ણ રથ સમુદ્રમાં દેખાયો""",2022-5-18,Vishvanews,,"""આંધ્રપ્રદેશના શ્રીકાકુલમ જિલ્લામાં સુન્નાપલ્લી ખાતે દરિયાના મોજામાંથી સોનાનો રથ દેખાયો તેવો દાવો ભ્રામક છે. આ રથ અથવા મંદિરનું માળખું સોનાનું નથી, પરંતુ સોનાના રંગ જેવું લાગે છે, જે લાકડા અને સ્ટીલથી બનેલું છે. અચાનક આવેલા વાવાઝોડાને કારણે આ માળખું મ્યાનમાર અથવા થાઈલેન્ડથી નીકળીને આંધ્ર પ્રદેશના દરિયાકાંઠાના વિસ્તારમાં આવી ગયું.""","""['https://perma.cc/2DWL-J6WN', 'https://www.youtube.com/watch?v=C5UgJ8IFTtA', 'https://www.youtube.com/embed/yBlaa3ciok0?feature=oembed', 'https://www.youtube.com/embed/hor1o5mh-NY?feature=oembed', 'https://www.youtube.com/embed/1x09HHTnRSo?feature=oembed']""","""Fact Check: આંધ્રના શ્રીકાકુલમ જિલ્લાના સુન્નાપલ્લી ખાતે દરિયાના મોજામાંથી સુવર્ણ રથનો દાવો ભ્રામક છે.""","""['Fact Check']""",,,,,
103,,,,False,"""Jai Tripathi Journalist""",,,Vishvanews,,https://www.vishvasnews.com/gujarati/viral/fact-check-women-assault-video-of-train-does-not-related-to-kashmir-files/,"""ટ્રેનમાં યુવકને માર મારતી એક મહિલાનો વીડિયો કાશ્મીર ફાઇલ્સ રિલીઝ થયા બાદનો છે.""",2022-3-25,Vishvanews,,"""વાયરલ વીડિયો ઑક્ટોબર 2021નો છે, જ્યારે ફિલ્મ ‘ધ કાશ્મીર ફાઇલ્સ’ 11 માર્ચ, 2022ના રોજ રિલીઝ થઈ છે. મતલબ કે વાયરલ વિડીયો ફિલ્મ રીલીઝ થવાના પાંચ મહિના પહેલાનો છે.""","""['https://thewire.in/communalism/hate-watch-hindutva-madhu-sharma-bjp-narsinghanand-assaults-muslim-man-train', 'https://www.jagran.com/entertainment/box-office-the-kashmir-files-daily-box-office-collection-vivek-agnihotri-film-200-crores-earnings-movie-on-violence-in-valley-22561794.html', 'https://www.facebook.com/jai.tripathi.184']""","""Fact Check: ટ્રેનમાં યુવકને માર મારતી મહિલાનો વીડિયો Kashmir Files રિલીઝ થયા પહેલાનો છે, ભ્રામક દાવો થયો વાયરલ""","""['Fact Check', 'the kashmir files']""",,,,,
104,,,,False,"""Varun Raj Khurana""",,,Vishvanews,,https://www.vishvasnews.com/gujarati/health/lady-talking-about-prevention-of-the-coronavirus-in-this-video-is-not-a-doctor-from-medanta/,"""दोस्तो, यह Ma'am बहुत सीनियर Doctor है,""",2020-7-17,Vishvanews,,"""નિષ્કર્ષ: વિશ્વાસ ન્યૂઝની તપાસમાં મેદાંતા હોસ્પિટલના નામે વાયરલ થયેલો વીડિયો નકલી હોવાનું બહાર આવ્યું છે. વીડિયોમાં જોવા મળતી મહિલા એક શિક્ષક છે. તેનો મેદંતા અથવા કોઈ હોસ્પિટલ સાથે કોઈ જોડાણ નથી.""","""['http://archive.md/b7YKu', 'https://www.facebook.com/anju.kaur.1069/videos/3094661443934619/', 'https://www.who.int/emergencies/diseases/novel-coronavirus-2019/advice-for-public/myth-busters', 'https://www.facebook.com/anju.kaur.1069/posts/3099897186744378?hc_location=ufi']""","""Fact Check : કોરોનાથી બચાવ જણાવી રહી છે તે મહિલા મેદાંતાની ડોક્ટર નથી,""","""['Medanta Hospital']""",,,,,
105,,,,False,"""Phạm Hạnh""",,,Vishvanews,,https://www.vishvasnews.com/gujarati/health/fact-check-consuming-large-doses-of-vitamin-c-cannot-stop-the-spread-of-covid2019/,"""વિટામિન સીનો મોટો ડોઝ લેવાથી કોરોનાવાયરસનો ફેલાવો અટકી શકે છે""",2020-6-4,Vishvanews,,"""નિષ્કર્ષ: વિટામિન સીની મોટા પ્રમાણમાં સેવન કરવાથી કોરોનાવાયરસનો ફેલાવો રોકી શકાતો નથી. ત્યાં કોઈ પુરાવા નથી કે વિટામિન સીની મોટી માત્રા પીવાથી કોરોનાવાયરસનો ફેલાવો રોકી શકાય છે.""","""['https://archive.md/wip/quFaI', 'https://archive.md/wip/cs5GC', 'https://archive.md/wip/AK10V', 'https://www.cdc.gov/coronavirus/about/prevention.html', 'https://www.who.int/health-topics/coronavirus']""","""તથ્ય તપાસ: વિટામિન સી નુ વધારે સેવન કોરોનાવાયરસનો ફેલાવો રોકી શકતો નથી, આ વાઈરલ પોસ્ટ ખોટી છે﻿""","""['Corona in Gujarat', 'Corona in India', 'Coronavirus', 'CoronaVirusFacts', 'COVID19', 'COVID2019']""",,,,,
106,,,,False,"""Steve Lock""",,,Vishvanews,,https://www.vishvasnews.com/gujarati/society/post-claiming-alcohol-kills-coronavirus-is-not-true/,"""આલ્કોહોલ કોરોનાવાયરસને મારી નાખે છે""",2020-4-9,Vishvanews,,"""આલ્કોહોલ કોરોનાવાયરસને મારી નાખે છે તેવો દાવો કરનારી આ પોસ્ટ ખોટી છે.""","""['https://archive.md/wip/ICF1E', 'https://www.cdc.gov/coronavirus/2019-ncov/about/prevention-treatment.html', 'https://www.who.int/emergencies/diseases/novel-coronavirus-2019/advice-for-public/myth-busters', 'https://www.who.int/emergencies/diseases/novel-coronavirus-2019/advice-for-public/myth-busters']""","""તથ્ય તપાસ: આલ્કોહોલ કોરોનાવાયરસને મારી નાંખે છે તે પછી પોસ્ટ ખોટી છે""","""['CoronaVirusFacts COVID19', 'COVID19', 'COVID2019']""",,,,,
107,,,,False,"""Merges_BTN""",,,Vishvanews,,https://www.vishvasnews.com/gujarati/politics/fact-check-viral-women-is-not-urkaine-vice-presidents-vice/,"""This is the wife of the Vice President of Ukraine. She is fighting for her Motherland. Massive Respect.""",2022-3-11,Vishvanews,,"""વિશ્વાસ ન્યૂઝે પોતાની તપાસમાં શોધ્યું કે આ તસવીર જૂની છે. તેને યૂક્રેન-રશિયા યુદ્ધ સાથે કશું લાગતુંવળગતું નથી. અમને જાણવા મળ્યું કે યૂક્રેનમાં ‘ઉપરાષ્ટ્રપતિ’ જેવી કોઈ પોઝિશન નથી.""","""['https://www.facebook.com/mergesbhutan/posts/462429055314607', 'https://www.alamy.com/kyiv-ukraine-august-22-2021-rehearsal-of-the-military-parade-on-occasion-of-30-years-independence-day-of-ukraine-ukrainian-female-soldier-image439695719.html', 'https://www.shutterstock.com/image-photo/kyiv-ukraine-august-22-2021-rehearsal-2030304626']""","""Fact Check: યૂક્રેનના ઉપરાષ્ટ્રપતિની પત્ની નથી વાયરલ તસવીરમાં દેખાઈ રહેલ સૈનિક, જૂની તસવીર ખોટા સંદર્ભમાં વાયરલ""","""['Fact Check', 'Russia- Ukraine War', 'Ukraine Crisis']""",,,,,
108,,,,False,"""रवींद्र भारतीय""",,,Vishvanews,,https://www.vishvasnews.com/gujarati/world/fact-check-2009-photo-of-us-capitol-now-viral-with-wrong-claims/,"""जो बाइडेन का नया अमेरिका कैपिटल हिल के सामने जुम्मे के दिन।""",2021-2-21,Vishvanews,,"""વિશ્વાસ ન્યૂઝને જાણવા મળ્યું છે કે વાયરલ થયેલી તસવીર સાથે કરવામાં આવેલ દાવા ખોટા છે. આ તસવીર વર્ષ 2009 ની છે.""","""['https://www.facebook.com/permalink.php?story_fbid=463862141440867&id=100034512554231', 'https://archive.fo/wip/XNKae', 'https://www.gettyimages.in/photos/islam-on-capitol-hill-2009?phrase=islam%20on%20capitol%20hill%202009&sort=mostpopular', 'http://ibtimes.com/']""","""Fact Check: 2009 નો યુએસ કેપિટલનો ફોટો ભ્રામક દાવાઓ સાથે વાયરલ થઈ રહ્યો છે""","""['US Capitol']""",,,,,
109,,,,False,"""myck @smbsultan""",,,Vishvanews,,https://www.vishvasnews.com/gujarati/world/fact-check-the-child-in-this-picture-with-joe-biden-is-not-floyds-daughter-viral-claim-is-not-true/,"""US President Trump's new president Joe Biden has apologized for kneeling in front of the daughter of a black man who was strangled to death by white American police during the Trump administration.""",2020-11-26,Vishvanews,,"""વિશ્વાસ ન્યૂઝની તપાસમાં બહાર આવ્યું છે કે વાયરલ દાવો ખોટો છે. ફોટો લેનારા ફોટોગ્રાફરે અમને સમજાવ્યું કે ફોટામાં જે બાળક દેખાય છે તે ફ્લોઈડની પુત્રી નથી.""","""['https://twitter.com/smbsultan/status/1326491981527183361', 'https://archive.fo/RBFts', 'https://www.nytimes.com/article/george-floyd.html', 'https://www.jagran.com/world/america-global-leaders-react-to-joe-biden-victory-in-america-21041200.html', 'https://www.outlookindia.com/photos/people/joe-biden/12286?photo-238864', 'https://www.instagram.com/p/CFKYTOnhvtJ/?utm_source=ig_embed', 'https://twitter.com/LeahMillis?ref_src=twsrc%5Etfw', 'https://t.co/hKVPZKIPFe', 'https://abcnews.go.com/GMA/News/george-floyds-daughter-speaks-dad-time/story?id=71031800', 'https://t.co/b2ZWQB8Qdq']""","""તથ્ય તપાસો: આ ફોટામા જો બિડેન સાથે ફ્લોઈડની પુત્રી નથી, વાયરલ દાવો ખોટો છે""","""['america george floyd', 'Floyd', 'Joe Biden']""",,,,,
110,,,,Misleading,"""amethi raebareli ki kahani""",,,Vishvanews,,https://www.vishvasnews.com/gujarati/politics/fact-check-the-picture-of-a-hospital-in-nagpur-maharashtra-is-going-viral-in-the-name-of-gujarat-2/,"""दुनिया में सबसे ऊंचा स्टैचू गुजरात में....विकास मॉडल गुजरात के अस्पताल का हालत देखिए....एक महिला के साथ दो पुरुष मरीज एक ही बेड पर....""",2022-6-17,Vishvanews,,"""વિશ્વ ન્યૂઝની તપાસમાં વાયરલ થયેલો દાવો ખોટો નીકળ્યો. વાયરલ તસવીર ગુજરાતની નહીં પરંતુ મહારાષ્ટ્રના નાગપુરની સરકારી હોસ્પિટલની છે.""","""['https://twitter.com/MeghaSPrasad/status/1382353354458755075', 'https://twitter.com/hashtag/nagpur?src=hash&ref_src=twsrc%5Etfw', 'https://twitter.com/hashtag/Maharashtra?src=hash&ref_src=twsrc%5Etfw', 'https://twitter.com/hashtag/COVID19?src=hash&ref_src=twsrc%5Etfw', 'https://t.co/AdKrZNFYnU']""","""Fact Check: મહારાષ્ટ્રના નાગપુરની એક હોસ્પિટલની તસવીર ગુજરાતના નામે વાયરલ થઈ રહી છે.""","""['Fact Check']""",,,,,
111,,,,False,"""Shrigopal Sharma""",,,Vishvanews,,https://www.vishvasnews.com/gujarati/viral/fact-check-pfizer-vice-president-ready-johnson-was-not-arrested-satire-report-shared-as-true/,""": VP of Pfizer group arrested after leaked documents show only 12% vaccine efficacy and severe side effects. Thanking our govt that Pfizer was not allowed in India.""",2022-5-25,Vishvanews,,"""વિશ્વાસ ન્યૂઝની તપાસમાં વાયરલ થયેલો દાવો ખોટો નીકળ્યો. વાયરલ પોસ્ટ એક વ્યંગ્ય છે અને તેને સત્ય સાથે કોઈ લેવાદેવા નથી. વિશ્વાસ ન્યૂઝને તેની તપાસમાં જાણવા મળ્યું કે આ કોઈ વાસ્તવિક ઘટના નથી, પરંતુ રમૂજના હેતુથી લખાયેલા કાલ્પનિક લેખનો સ્ક્રીનશોટ છે. આ લેખ ‘Vancouver Times’ નામની વેબસાઈટ પર પ્રકાશિત થયો હતો. આ વેબસાઈટ માત્ર કાલ્પનિક અને વ્યંગાત્મક વાર્તાઓ જ પ્રકાશિત કરે છે.""","""['https://www.facebook.com/photo?fbid=5290552550966606&set=a.557683374253571', 'https://perma.cc/99YL-2A9P', 'https://www.linkedin.com/in/rady-johnson-0ab46a7?original_referer=https%3A%2F%2Fwww.google.com%2F', 'https://t.co/OuF96mN9l9', 'https://twitter.com/hashtag/HealthEquity?src=hash&ref_src=twsrc%5Etfw', 'https://twitter.com/hashtag/WEF22?src=hash&ref_src=twsrc%5Etfw', 'https://t.co/R9pboifXz7', 'https://vancouvertimes.org/vp-of-pfizer-arrested-after-document-dump/', 'https://vancouvertimes.org/vp-of-pfizer-arrested-after-document-dump/embed/#?secret=PG1PjiTtgt#?secret=RKoMuWzGwD']""","""Fact Check: ફાઈઝરના વાઇસ પ્રેસિડેન્ટ રેડી જોન્સનની ધરપકડ કરવામાં આવી ન હતી, વપરાશકર્તાઓ વ્યંગાત્મક અહેવાલને સાચા તરીકે શેર કરે છે""","""['Coronavirus', 'COVID19', 'Fact Check', 'Pfizer', 'vaccine']""",,,,,
112,,,,False,"""Virag Pandey""",,,Vishvanews,,https://www.vishvasnews.com/gujarati/politics/fact-check-mysterious-gold-chariot-found-in-srikakulam-sea-at-andhra-pradesh-is-misleading-in-nature/,"""મંદિરના આકારનો સુવર્ણ રથ સમુદ્રમાં દેખાયો""",2022-5-18,Vishvanews,,"""આંધ્રપ્રદેશના શ્રીકાકુલમ જિલ્લામાં સુન્નાપલ્લી ખાતે દરિયાના મોજામાંથી સોનાનો રથ દેખાયો તેવો દાવો ભ્રામક છે. આ રથ અથવા મંદિરનું માળખું સોનાનું નથી, પરંતુ સોનાના રંગ જેવું લાગે છે, જે લાકડા અને સ્ટીલથી બનેલું છે. અચાનક આવેલા વાવાઝોડાને કારણે આ માળખું મ્યાનમાર અથવા થાઈલેન્ડથી નીકળીને આંધ્ર પ્રદેશના દરિયાકાંઠાના વિસ્તારમાં આવી ગયું.""","""['https://perma.cc/2DWL-J6WN', 'https://www.youtube.com/watch?v=C5UgJ8IFTtA', 'https://www.youtube.com/embed/yBlaa3ciok0?feature=oembed', 'https://www.youtube.com/embed/hor1o5mh-NY?feature=oembed', 'https://www.youtube.com/embed/1x09HHTnRSo?feature=oembed']""","""Fact Check: આંધ્રના શ્રીકાકુલમ જિલ્લાના સુન્નાપલ્લી ખાતે દરિયાના મોજામાંથી સુવર્ણ રથનો દાવો ભ્રામક છે.""","""['Fact Check']""",,,,,
113,,,,False,"""ફેસબુક યુઝર સંજીવ મિશ્રા""",,,Vishvanews,,https://www.vishvasnews.com/gujarati/politics/fact-check-fake-tweet-going-viral-again-in-the-name-of-nita-ambani/,"""નીતા અંબાણીની ટ્વીટ""",2022-5-13,Vishvanews,,"""વિશ્વાસ ન્યૂઝની તપાસમાં, નીતા અંબાણીના નામે વાયરલ થઈ રહેલી ટ્વિટ નકલી સાબિત થઈ. તે ટ્વિટર પર હાજર નથી.""","""['https://www.facebook.com/permalink.php?story_fbid=2977557135869896&id=100008469151193']""","""Fact Check : નીતા અંબાણીના નામની નકલી ટ્વિટ ફરી વાયરલ થઈ""","""['Fact Check', 'Nita Ambani']""",,,,,
114,,,,False,"""Jai Tripathi Journalist""",,,Vishvanews,,https://www.vishvasnews.com/gujarati/viral/fact-check-women-assault-video-of-train-does-not-related-to-kashmir-files/,"""ટ્રેનમાં યુવકને માર મારતી એક મહિલાનો વીડિયો કાશ્મીર ફાઇલ્સ રિલીઝ થયા બાદનો છે.""",2022-3-25,Vishvanews,,"""વાયરલ વીડિયો ઑક્ટોબર 2021નો છે, જ્યારે ફિલ્મ ‘ધ કાશ્મીર ફાઇલ્સ’ 11 માર્ચ, 2022ના રોજ રિલીઝ થઈ છે. મતલબ કે વાયરલ વિડીયો ફિલ્મ રીલીઝ થવાના પાંચ મહિના પહેલાનો છે.""","""['https://thewire.in/communalism/hate-watch-hindutva-madhu-sharma-bjp-narsinghanand-assaults-muslim-man-train', 'https://www.jagran.com/entertainment/box-office-the-kashmir-files-daily-box-office-collection-vivek-agnihotri-film-200-crores-earnings-movie-on-violence-in-valley-22561794.html', 'https://www.facebook.com/jai.tripathi.184']""","""Fact Check: ટ્રેનમાં યુવકને માર મારતી મહિલાનો વીડિયો Kashmir Files રિલીઝ થયા પહેલાનો છે, ભ્રામક દાવો થયો વાયરલ""","""['Fact Check', 'the kashmir files']""",,,,,
